Title,Category,Tags,Challenge_Addressed,Business_Stage,Resource_Type,Time_Investment,Difficulty_Level,Prerequisites,Expected_Outcome,Keywords,Description
"Day 1: Complete Spiritual Business Vision Clarity","Vision Setting","vision, clarity, purpose","Unclear business direction","Starting out","Milestone","2 hours","Intermediate","None","Clear 60-day vision","vision clarity purpose","Creating clear spiritual business vision"
"Day 3: Identify Top 3 Spiritual Gifts to Monetize","Gift Identification","gifts, monetization, skills","Gift-to-income confusion","Starting out","Assessment","1 hour","Beginner","Self-awareness","Identified monetizable gifts","gifts monetization skills","Identifying most valuable spiritual gifts"
"Day 5: Complete Money Mindset Assessment","Money Mindset","money, mindset, blocks","Money blocks","All stages","Assessment","45 min","Intermediate","Self-reflection","Awareness of money blocks","money mindset blocks","Understanding personal money beliefs"
"Day 7: Create Sacred Business Mission Statement","Mission Creation","mission, sacred, purpose","Mission confusion","Starting out","Creation","1 hour","Intermediate","Vision clarity","Clear business mission","mission sacred purpose","Written spiritual business mission"
"Day 10: Design First Spiritual Service Offering","Service Design","service, offering, design","Service creation","Starting out","Creation","3 hours","Intermediate","Gift identification","Designed spiritual service","service offering design","First spiritual service offering"
"Day 12: Set Soul-Aligned Pricing for Services","Pricing Strategy","pricing, soul-aligned, value","Pricing confidence","Starting out","Strategy","2 hours","Advanced","Service design","Confident pricing structure","pricing soul-aligned value","Spiritual service pricing strategy"
"Day 15: Create Authentic About Page","About Page","about page, authentic, story","Personal brand clarity","Starting out","Creation","2 hours","Intermediate","Personal story","Compelling about page","about page authentic story","Vulnerable authentic about page"
"Day 17: Identify Ideal Soul-Aligned Clients","Client Identification","ideal clients, soul-aligned, targeting","Client clarity","Starting out","Research","1 hour","Intermediate","Service clarity","Clear ideal client profile","ideal clients soul-aligned","Defining perfect spiritual clients"
"Day 20: Create First Sacred Marketing Content","Content Creation","marketing, content, sacred","Content creation","Starting out","Creation","2 hours","Intermediate","Message clarity","Authentic marketing content","marketing content sacred","First spiritual marketing materials"
"Day 22: Establish Spiritual Business Boundaries","Boundary Setting","boundaries, business, protection","Boundary confusion","All stages","Setting","1 hour","Advanced","Self-awareness","Clear business boundaries","boundaries business protection","Professional spiritual boundaries"
"Day 25: Launch First Spiritual Service","Service Launch","launch, service, offering","Taking action on services","Starting out","Launch","4 hours","Advanced","Service readiness","Live spiritual service","launch service offering","First spiritual service goes live"
"Day 27: Create Spiritual Client Intake Process","Intake Process","intake, process, client","Client onboarding","All stages","Process","1 hour","Intermediate","Service structure","Professional intake process","intake process client","Spiritual client onboarding system"
"Day 30: Complete First Month Business Review","Business Review","review, assessment, progress","Progress tracking","All stages","Review","1 hour","Intermediate","Business activity","Clear progress assessment","review assessment progress","30-day spiritual business assessment"
"Day 32: Develop Consistent Spiritual Practice Routine","Practice Routine","practice, routine, consistency","Inconsistent practice","All stages","Development","1 hour","Intermediate","Practice experience","Daily spiritual practice","practice routine consistency","Daily spiritual business practice"
"Day 35: Create Sacred Workspace","Workspace Creation","workspace, sacred, environment","Uninspiring work environment","All stages","Creation","2 hours","Beginner","Work space","Inspiring sacred workspace","workspace sacred environment","Creating sacred business space"
"Day 37: Establish Spiritual Business Network","Networking","networking, community, connections","Professional isolation","Scaling","Networking","2 hours","Intermediate","Networking skills","Professional spiritual connections","networking community connections","Building spiritual business network"
"Day 40: Optimize Spiritual Service Delivery","Service Optimization","optimization, delivery, improvement","Service improvement","Scaling","Optimization","2 hours","Advanced","Service experience","Improved service delivery","optimization delivery improvement","Enhancing spiritual service quality"
"Day 42: Create Second Spiritual Service Offering","Service Expansion","expansion, service, growth","Service diversification","Scaling","Creation","3 hours","Advanced","Successful first service","Multiple service offerings","expansion service growth","Second spiritual service creation"
"Day 45: Implement Client Feedback System","Feedback System","feedback, system, improvement","Service improvement tracking","Scaling","Implementation","1 hour","Intermediate","Client relationships","Regular improvement feedback","feedback system improvement","Client feedback collection system"
"Day 47: Create Spiritual Content Calendar","Content Planning","content, calendar, planning","Content consistency","Scaling","Planning","2 hours","Intermediate","Content creation","Consistent spiritual content","content calendar planning","30-day spiritual content plan"
"Day 50: Launch Spiritual Email Newsletter","Newsletter Launch","newsletter, email, launch","Regular communication","Scaling","Launch","3 hours","Advanced","Email platform","Active email list","newsletter email launch","Spiritual business newsletter launch"
"Day 52: Create Referral Program for Spiritual Services","Referral Program","referral, program, growth","Client acquisition","Scaling","Program","2 hours","Intermediate","Client base","Client referral system","referral program growth","Spiritual service referral system"
"Day 55: Establish Monthly Business Rituals","Business Rituals","rituals, business, monthly","Lack of business rhythm","All stages","Establishment","1 hour","Intermediate","Ritual practice","Monthly business rhythm","rituals business monthly","Monthly spiritual business practices"
"Day 57: Create Spiritual Business Financial System","Financial System","financial, system, tracking","Money management","Scaling","System","2 hours","Advanced","Basic accounting","Organized business finances","financial system tracking","Spiritual business money management"
"Day 60: Complete 60-Day Transformation Assessment","Final Assessment","assessment, transformation, completion","Progress evaluation","All stages","Assessment","2 hours","Advanced","60-day journey","Complete transformation review","assessment transformation completion","Comprehensive 60-day progress evaluation"
"Week 1: Establish Morning Spiritual Business Routine","Weekly Routines","routine, morning, spiritual","Inconsistent daily practice","All stages","Routine","30 min daily","Beginner","None","Consistent morning practice","routine morning spiritual","Daily spiritual business morning routine"
"Week 2: Create Weekly Spiritual Business Planning","Weekly Planning","planning, weekly, spiritual","Lack of weekly structure","All stages","Planning","1 hour weekly","Intermediate","Basic planning","Weekly spiritual business rhythm","planning weekly spiritual","Weekly spiritual business planning session"
"Week 3: Implement Weekly Client Check-Ins","Client Check-Ins","check-ins, client, weekly","Client relationship maintenance","Scaling","Implementation","2 hours weekly","Intermediate","Client relationships","Stronger client relationships","check-ins client weekly","Weekly client relationship nurturing"
"Week 4: Create Weekly Content Creation Block","Content Blocks","content, creation, weekly","Content consistency","Scaling","Blocking","3 hours weekly","Intermediate","Content skills","Regular content creation","content creation weekly","Weekly content creation time block"
"Week 5: Establish Weekly Financial Review","Financial Review","financial, review, weekly","Money management","Scaling","Review","1 hour weekly","Advanced","Financial tracking","Weekly money consciousness","financial review weekly","Weekly spiritual business financial check"
"Week 6: Implement Weekly Spiritual Business Learning","Learning Time","learning, business, growth","Skill development","All stages","Learning","2 hours weekly","Intermediate","Learning commitment","Continuous business growth","learning business growth","Weekly spiritual business education"
"Week 7: Create Weekly Community Connection","Community Connection","community, connection, weekly","Professional isolation","All stages","Connection","1 hour weekly","Intermediate","Community access","Regular professional connections","community connection weekly","Weekly spiritual business community time"
"Week 8: Complete Weekly Progress Celebration","Progress Celebration","celebration, progress, weekly","Lack of acknowledgment","All stages","Celebration","30 min weekly","Beginner","None","Regular achievement recognition","celebration progress weekly","Weekly spiritual business progress celebration"
"Month 1: Launch First Spiritual Service","Monthly Milestones","launch, service, monthly","Service implementation","Starting out","Launch","Multiple sessions","Advanced","Service preparation","Live spiritual service","launch service monthly","First month service launch goal"
"Month 2: Establish Sustainable Business Rhythm","Rhythm Establishment","rhythm, sustainable, business","Unsustainable pace","All stages","Establishment","Ongoing","Advanced","Month 1 completion","Sustainable business operations","rhythm sustainable business","Second month sustainability focus"
"10-Day Challenge: Daily Spiritual Business Affirmations","Mini Challenges","affirmations, daily, challenge","Negative self-talk","All stages","Challenge","5 min daily","Beginner","None","Positive business mindset","affirmations daily challenge","10-day positive mindset challenge"
"14-Day Challenge: Spiritual Business Content Creation","Content Challenge","content, creation, consistency","Content creation consistency","Scaling","Challenge","30 min daily","Intermediate","Content skills","Consistent content habit","content creation consistency","14-day content creation challenge"
"21-Day Challenge: Sacred Money Relationship","Money Challenge","money, relationship, sacred","Money mindset healing","All stages","Challenge","15 min daily","Advanced","Money work","Healed money relationship","money relationship sacred","21-day money mindset transformation"
"30-Day Challenge: Spiritual Business Community Building","Community Challenge","community, building, connection","Community building","Scaling","Challenge","20 min daily","Advanced","Community strategy","Engaged spiritual community","community building connection","30-day community building challenge"
"7-Day Intensive: Spiritual Service Design","Service Design","service, design, intensive","Service creation focus","Starting out","Intensive","2 hours daily","Advanced","Service concept","Complete service design","service design intensive","Week-long service creation intensive"
"3-Day Mini-Retreat: Business Vision Clarity","Vision Retreat","vision, clarity, retreat","Vision confusion","Starting out","Retreat","4 hours daily","Advanced","Retreat space","Crystal clear business vision","vision clarity retreat","3-day business vision clarification"
"5-Day Sprint: Spiritual Marketing Materials","Marketing Sprint","marketing, materials, sprint","Marketing material creation","Scaling","Sprint","3 hours daily","Advanced","Marketing strategy","Complete marketing kit","marketing materials sprint","5-day marketing creation sprint"
"Milestone: First $1000 in Spiritual Services","Revenue Milestones","revenue, first income, milestone","Income generation","Starting out","Milestone","Varies","Advanced","Service offerings","$1000 in spiritual income","first income milestone","Achieving first $1000 in spiritual services"
"Milestone: 100 Engaged Community Members","Community Milestones","community, members, engagement","Community growth","Scaling","Milestone","Varies","Advanced","Community strategy","100 engaged members","community members engagement","Building community of 100 engaged members"
"Milestone: 10 Spiritual Client Testimonials","Testimonial Milestones","testimonials, clients, social proof","Social proof building","All stages","Milestone","Varies","Intermediate","Client relationships","10 powerful testimonials","testimonials clients social proof","Collecting 10 spiritual client testimonials"
"Milestone: Consistent $5000 Monthly Spiritual Income","Income Milestones","income, monthly, consistent","Sustainable income","Scaling","Milestone","Varies","Advanced","Established services","$5000 monthly spiritual income","monthly income consistent","Achieving consistent monthly spiritual income"
"Milestone: 50 Sacred Service Deliveries","Service Milestones","service, delivery, experience","Service experience","Scaling","Milestone","Varies","Advanced","Service launch","50 spiritual service deliveries","service delivery experience","Completing 50 spiritual service sessions"
"Milestone: Spiritual Business Waiting List","Demand Milestones","waiting list, demand, popular","High demand services","Scaling","Milestone","Varies","Advanced","Popular services","Spiritual business waiting list","waiting list demand popular","Creating waiting list for spiritual services"
"Milestone: Featured in Spiritual Publication","Visibility Milestones","publication, featured, visibility","Media recognition","Established","Milestone","Varies","Advanced","Established expertise","Media feature","publication featured visibility","Getting featured in spiritual media"
"Milestone: Spiritual Speaking Engagement Booking","Speaking Milestones","speaking, engagement, booking","Speaking opportunities","Established","Milestone","Varies","Advanced","Speaking skills","Paid speaking engagement","speaking engagement booking","Booking first spiritual speaking engagement"
"Milestone: 1000 Spiritual Social Media Followers","Social Milestones","followers, social media, audience","Social media growth","Scaling","Milestone","Varies","Intermediate","Social strategy","1000 aligned followers","followers social media audience","Building 1000 spiritual social media followers"
"Milestone: Spiritual Business Collaboration","Collaboration Milestones","collaboration, partnership, business","Partnership building","Scaling","Milestone","Varies","Advanced","Network building","Successful spiritual business collaboration","collaboration partnership business","Creating first spiritual business partnership"
"Milestone: Sacred Service Product Creation","Product Milestones","product, creation, spiritual","Product development","Scaling","Milestone","Varies","Advanced","Service success","Spiritual digital product","product creation spiritual","Creating first spiritual digital product"
"Milestone: Spiritual Business Team Member","Team Milestones","team, member, growth","Business scaling","Established","Milestone","Varies","Advanced","Revenue growth","First team member","team member growth","Hiring first spiritual business team member"
"Milestone: Spiritual Business Systems Automation","Automation Milestones","automation, systems, efficiency","Business efficiency","Scaling","Milestone","Varies","Advanced","Tech skills","Automated business systems","automation systems efficiency","Implementing business automation systems"
"Milestone: 10k Monthly Spiritual Business Revenue","Revenue Growth","revenue, growth, 10k","Revenue scaling","Established","Milestone","Varies","Advanced","Consistent 5k","$10k monthly spiritual income","revenue growth 10k","Achieving $10k monthly spiritual revenue"
"Micro-Goal: Daily Spiritual Business Affirmations","Daily Goals","affirmations, daily, micro","Mindset maintenance","All stages","Micro-Goal","5 min daily","Beginner","None","Positive daily mindset","affirmations daily micro","Daily spiritual business mindset work"
"Micro-Goal: One Spiritual Business Connection Daily","Connection Goals","connection, networking, daily","Isolation healing","All stages","Micro-Goal","15 min daily","Beginner","Social platforms","Daily spiritual connections","connection networking daily","Making one spiritual business connection daily"
"Micro-Goal: Sacred Business Gratitude Practice","Gratitude Goals","gratitude, practice, sacred","Negative business focus","All stages","Micro-Goal","5 min daily","Beginner","None","Daily business gratitude","gratitude practice sacred","Daily spiritual business gratitude"
"Micro-Goal: Energy Check-In Before Business Tasks","Energy Goals","energy, check-in, awareness","Energetic misalignment","All stages","Micro-Goal","3 min","Beginner","Energy awareness","Aligned business energy","energy check-in awareness","Daily energy alignment practice"
"Micro-Goal: One Spiritual Business Learning Daily","Learning Goals","learning, daily, growth","Skill stagnation","All stages","Micro-Goal","20 min daily","Beginner","Learning resources","Daily skill growth","learning daily growth","Daily spiritual business education"
"Weekly Goal: Complete Sacred Service Session","Weekly Service","service, session, weekly","Service consistency","Starting out","Weekly Goal","Varies","Intermediate","Service offering","Weekly service delivery","service session weekly","Delivering one spiritual service weekly"
"Weekly Goal: Create 5 Spiritual Social Media Posts","Weekly Content","content, social media, posts","Content consistency","All stages","Weekly Goal","2 hours","Intermediate","Social accounts","Regular spiritual content","content social media posts","Creating weekly spiritual content"
"Weekly Goal: Connect with 3 Spiritual Entrepreneurs","Weekly Networking","networking, entrepreneurs, connection","Network building","All stages","Weekly Goal","1 hour","Intermediate","Networking platforms","Expanded spiritual network","networking entrepreneurs connection","Weekly spiritual entrepreneur networking"
"Weekly Goal: Complete Money Mindset Exercise","Weekly Money Work","money, mindset, exercise","Money healing","All stages","Weekly Goal","30 min","Advanced","Money work tools","Improved money relationship","money mindset exercise","Weekly money mindset healing work"
"Weekly Goal: Update Spiritual Business Strategy","Weekly Strategy","strategy, update, business","Strategic alignment","Scaling","Weekly Goal","1 hour","Advanced","Strategy framework","Aligned business strategy","strategy update business","Weekly business strategy alignment"
"Bi-Weekly Goal: Sacred Business Planning Session","Bi-Weekly Planning","planning, business, sacred","Business direction","All stages","Bi-Weekly Goal","2 hours","Advanced","Planning skills","Clear business direction","planning business sacred","Bi-weekly spiritual business planning"
"Bi-Weekly Goal: Spiritual Business Finance Review","Bi-Weekly Finance","finance, review, business","Financial management","Scaling","Bi-Weekly Goal","1 hour","Advanced","Financial tracking","Healthy money management","finance review business","Bi-weekly business financial check"
"Monthly Goal: Sacred Business Vision Update","Monthly Vision","vision, update, monthly","Vision evolution","All stages","Monthly Goal","2 hours","Advanced","Vision work","Evolved business vision","vision update monthly","Monthly business vision refinement"
"Monthly Goal: Spiritual Service Package Creation","Monthly Package","package, service, creation","Service expansion","Scaling","Monthly Goal","6 hours","Advanced","Service success","New service package","package service creation","Monthly new service package"
"Monthly Goal: Spiritual Business Community Event","Monthly Event","event, community, spiritual","Community engagement","Scaling","Monthly Goal","4 hours","Advanced","Community building","Engaged community event","event community spiritual","Monthly spiritual community gathering"
"Quarterly Goal: Spiritual Business Retreat Planning","Quarterly Retreat","retreat, planning, business","Deep business work","Established","Quarterly Goal","1 week","Advanced","Retreat experience","Planned spiritual business retreat","retreat planning business","Quarterly business retreat planning"
"Sprint Goal: 7-Day Sacred Service Creation","Service Sprint","service, creation, sprint","Fast service development","Starting out","Sprint","3 hours daily","Advanced","Service design","Complete service in 7 days","service creation sprint","Week-long service creation focus"
"Sprint Goal: 5-Day Spiritual Marketing Campaign","Marketing Sprint","marketing, campaign, sprint","Marketing momentum","Scaling","Sprint","2 hours daily","Advanced","Marketing skills","Complete marketing campaign","marketing campaign sprint","5-day marketing campaign creation"
"Sprint Goal: 3-Day Sacred Brand Development","Brand Sprint","brand, development, sacred","Brand clarity","Starting out","Sprint","4 hours daily","Advanced","Brand basics","Complete spiritual brand","brand development sacred","3-day spiritual brand creation"
"Challenge: 30 Days of Spiritual Business Posts","Content Challenge","posts, content, challenge","Content creation habit","All stages","Challenge","20 min daily","Intermediate","Social accounts","Consistent content habit","posts content challenge","30-day spiritual content creation"
"Challenge: 14 Days of Sacred Sales Conversations","Sales Challenge","sales, conversations, sacred","Sales comfort","Starting out","Challenge","30 min daily","Advanced","Sales training","Comfortable spiritual sales","sales conversations sacred","14-day spiritual sales practice"
"Challenge: 21 Days of Money Mindset Work","Money Challenge","money, mindset, challenge","Money relationship healing","All stages","Challenge","15 min daily","Advanced","Money work","Healed money mindset","money mindset challenge","21-day money healing challenge"
"Intensive: 3-Day Spiritual Business Foundation","Foundation Intensive","foundation, intensive, business","Business basics","Starting out","Intensive","6 hours daily","Advanced","Commitment","Solid business foundation","foundation intensive business","3-day business foundation intensive"
"Intensive: 5-Day Sacred Service Design Workshop","Service Intensive","service, design, workshop","Service creation mastery","Starting out","Intensive","4 hours daily","Advanced","Service basics","Master service design","service design workshop","5-day service creation intensive"
"Intensive: 7-Day Spiritual Marketing Mastery","Marketing Intensive","marketing, mastery, spiritual","Marketing confidence","Scaling","Intensive","3 hours daily","Advanced","Marketing basics","Marketing mastery","marketing mastery spiritual","7-day spiritual marketing intensive"
"Phase 1: Spiritual Awakening to Business Idea","Business Phases","awakening, idea, phase","Idea development","Starting out","Phase","Week 1-2","Intermediate","Spiritual awareness","Business idea clarity","awakening idea phase","First phase of spiritual business development"
"Phase 2: Business Foundation and Structure","Foundation Phase","foundation, structure, business","Business setup","Starting out","Phase","Week 3-4","Advanced","Business idea","Structured business foundation","foundation structure business","Second phase business foundation"
"Phase 3: Service Creation and Launch","Launch Phase","service, creation, launch","Service implementation","Starting out","Phase","Week 5-6","Advanced","Business foundation","Launched spiritual services","service creation launch","Third phase service launch"
"Phase 4: Growth and Community Building","Growth Phase","growth, community, scaling","Business expansion","Scaling","Phase","Week 7-8","Advanced","Service success","Growing spiritual business","growth community scaling","Fourth phase business growth"
"Integration: Daily Spiritual Business Check-In","Daily Integration","check-in, daily, integration","Daily alignment","All stages","Integration","10 min daily","Beginner","None","Daily business alignment","check-in daily integration","Daily spiritual business alignment practice"
"Integration: Weekly Sacred Business Review","Weekly Integration","review, weekly, sacred","Weekly assessment","All stages","Integration","45 min weekly","Intermediate","Business activity","Weekly business consciousness","review weekly sacred","Weekly spiritual business assessment"
"Integration: Monthly Spiritual Business Retreat","Monthly Integration","retreat, monthly, integration","Deep monthly work","All stages","Integration","Half day monthly","Advanced","Retreat skills","Monthly business breakthrough","retreat monthly integration","Monthly spiritual business deep work"
"Breakthrough: First Spiritual Income Received","Income Breakthroughs","income, first, breakthrough","Income achievement","Starting out","Breakthrough","Varies","Advanced","Service offering","First spiritual income","income first breakthrough","Celebrating first spiritual business income"
"Breakthrough: Comfortable with Spiritual Pricing","Pricing Breakthroughs","pricing, comfortable, breakthrough","Pricing confidence","Starting out","Breakthrough","Varies","Advanced","Pricing work","Confident spiritual pricing","pricing comfortable breakthrough","Breakthrough in spiritual service pricing"
"Breakthrough: Spiritual Business Community Connection","Community Breakthroughs","community, connection, breakthrough","Isolation breakthrough","All stages","Breakthrough","Varies","Advanced","Community engagement","Connected spiritual community","community connection breakthrough","Breakthrough in spiritual business community"
