Title,Category,Tags,Challenge_Addressed,Business_Stage,Resource_Type,Time_Investment,Difficulty_Level,Prerequisites,Expected_Outcome,Keywords,Description
"Sacred 1:1 Spiritual Coaching","Coaching Models","coaching, transformation, healing","Monetizing spiritual gifts","Starting out","Framework","2 weeks","Beginner","Coaching training","$3-10k monthly","spiritual coaching 1on1","Deep transformation work with individuals"
"Group Soul Circle Coaching","Coaching Models","group coaching, circles, community","Scaling impact","Scaling","Framework","1 month","Intermediate","Group facilitation skills","$5-15k monthly","group coaching circles community","Monthly group transformation circles"
"Spiritual Business Mastermind","Coaching Models","mastermind, business, spiritual","Combining spirituality + business","Established","Framework","3 months","Advanced","Business experience","$10-50k monthly","mastermind business spiritual","High-level spiritual entrepreneur community"
"Sacred Ceremony Facilitation","Ceremony Models","ceremonies, rituals, healing","Creating meaningful experiences","Starting out","Framework","1 week","Intermediate","Ceremony training","$500-5k per event","ceremony ritual facilitation","Weddings, life transitions, healing ceremonies"
"Digital Course: Spiritual Awakening","Course Models","courses, awakening, digital","Passive income creation","Scaling","Framework","3 months","Intermediate","Teaching ability","$5-20k monthly","digital course spiritual awakening","Self-paced transformation journey"
"Membership: Daily Spiritual Practice","Membership Models","membership, daily practice, community","Recurring revenue","Scaling","Framework","2 months","Intermediate","Content creation","$2-10k monthly","membership daily spiritual practice","Monthly spiritual practice community"
"Retreat Planning & Hosting","Event Models","retreats, immersion, transformation","High-value offerings","Established","Framework","6 months","Advanced","Event planning","$10-100k per retreat","retreat planning hosting","Multi-day transformational experiences"
"Spiritual Business Consulting","Consulting Models","consulting, business, strategy","Expertise monetization","Established","Framework","1 month","Advanced","Business expertise","$5-25k monthly","spiritual business consulting","Helping others build spiritual businesses"
"Sacred Art & Creative Services","Creative Models","art, creativity, healing","Creative expression income","Starting out","Framework","1 week","Beginner","Artistic ability","$1-5k monthly","sacred art creative services","Healing art, mandalas, spiritual design"
"Spiritual Writing & Publishing","Content Models","writing, books, publishing","Thought leadership","Scaling","Framework","6 months","Advanced","Writing skills","$2-20k monthly","spiritual writing publishing","Books, blogs, spiritual content"
"Intuitive Reading Services","Reading Models","intuitive, psychic, guidance","Psychic gift monetization","Starting out","Framework","1 week","Intermediate","Intuitive abilities","$2-8k monthly","intuitive psychic reading","Personal guidance sessions"
"Energy Healing Practice","Healing Models","energy healing, reiki, chakras","Healing gift monetization","Starting out","Framework","2 weeks","Intermediate","Healing certification","$3-12k monthly","energy healing reiki practice","Remote and in-person healing"
"Spiritual Life Coaching","Coaching Models","life coaching, spiritual, guidance","Life transformation","Starting out","Framework","1 month","Intermediate","Coaching certification","$4-15k monthly","spiritual life coaching","Holistic life guidance"
"Sacred Business Templates","Digital Products","templates, business, sacred","Passive product income","Scaling","Framework","1 month","Beginner","Design skills","$1-5k monthly","business templates sacred","Ready-made spiritual business tools"
"Meditation Teacher Training","Education Models","meditation, teaching, certification","Teaching spiritual practices","Established","Framework","6 months","Advanced","Meditation expertise","$5-25k per cohort","meditation teacher training","Certifying new meditation teachers"
"Spiritual Podcast Monetization","Content Models","podcast, monetization, spiritual","Content monetization","Scaling","Framework","3 months","Intermediate","Podcasting skills","$2-15k monthly","podcast spiritual monetization","Spiritual podcast with multiple revenue streams"
"Oracle Card Creation","Product Models","oracle cards, divination, creation","Creative product income","Scaling","Framework","6 months","Advanced","Artistic ability","$5-50k per deck","oracle cards creation divination","Custom oracle card deck development"
"Spiritual App Development","Tech Models","app, technology, spiritual","Tech integration","Established","Framework","12 months","Advanced","Tech team","$10-100k monthly","spiritual app technology","Meditation, guidance, or practice apps"
"Sacred Space Rental","Physical Models","space rental, ceremonies, events","Location-based income","Established","Framework","3 months","Advanced","Physical space","$2-10k monthly","sacred space rental ceremonies","Renting space for spiritual events"
"Spiritual Affiliate Marketing","Marketing Models","affiliate, partnerships, spiritual","Partnership income","Scaling","Framework","2 weeks","Beginner","Audience","$500-5k monthly","affiliate marketing spiritual","Promoting aligned spiritual products"
"Donation-Based Offerings","Alternative Models","donations, gifts, abundance","Non-traditional pricing","Starting out","Framework","1 week","Beginner","None","Heart-based income","donation based offerings gifts","Gift economy spiritual services"
"Spiritual Business Accelerator","Intensive Models","accelerator, intensive, business","High-touch transformation","Established","Framework","6 months","Advanced","Proven results","$25-100k per cohort","business accelerator spiritual","6-month intensive business program"
"Moon Cycle Business Planning","Planning Models","moon cycles, planning, ritual","Spiritual business timing","All stages","Framework","1 month","Intermediate","Astrology knowledge","Aligned business rhythm","moon cycle business planning","Business planning with lunar cycles"
"Sacred Sales Conversations","Sales Models","sales, sacred, conversations","Sales without sleaze","Starting out","Framework","2 weeks","Intermediate","Sales training","Higher conversion","sacred sales conversations","Heart-centered sales approach"
"Spiritual Subscription Box","Product Models","subscription, box, spiritual","Physical product income","Scaling","Framework","3 months","Advanced","Product sourcing","$5-25k monthly","subscription box spiritual","Monthly spiritual product curation"
"Energy Clearing for Businesses","Service Models","energy clearing, business, healing","Business energy healing","Established","Framework","1 week","Advanced","Energy work training","$1-5k per clearing","energy clearing business healing","Clearing stagnant business energy"
"Spiritual Content Creation","Content Models","content, creation, spiritual","Consistent content income","Scaling","Framework","2 months","Intermediate","Content skills","$2-10k monthly","spiritual content creation","Blogs, videos, social media content"
"Sacred Partnership Programs","Partnership Models","partnerships, collaboration, sacred","Collaboration income","Scaling","Framework","1 month","Intermediate","Network","$3-15k monthly","sacred partnership collaboration","Joint ventures with spiritual alignment"
"Intuitive Business Strategy","Strategy Models","intuitive, strategy, guidance","Strategic clarity","All stages","Framework","2 weeks","Advanced","Business experience","Clear direction","intuitive business strategy","Using intuition for business decisions"
"Spiritual Licensing Programs","Licensing Models","licensing, certification, spiritual","Scalable teaching","Established","Framework","6 months","Advanced","Proven methodology","$10-50k monthly","licensing certification spiritual","License your spiritual methodology"
"Heart-Centered Copywriting","Service Models","copywriting, heart-centered, authentic","Authentic marketing","Starting out","Framework","1 month","Intermediate","Writing skills","$3-12k monthly","copywriting heart-centered authentic","Spiritual copy that converts"
"Sacred Brand Photography","Service Models","photography, branding, sacred","Visual brand alignment","Starting out","Framework","2 weeks","Intermediate","Photography skills","$2-8k monthly","brand photography sacred","Soul-aligned visual branding"
"Spiritual Business Audit","Service Models","audit, assessment, spiritual","Business alignment check","Established","Framework","1 week","Advanced","Business analysis","$1-5k per audit","business audit spiritual","Comprehensive spiritual business review"
"Moon Circle Membership","Membership Models","moon circles, rituals, community","Monthly recurring revenue","Scaling","Framework","2 months","Intermediate","Moon knowledge","$2-8k monthly","moon circle membership community","Monthly new moon ceremony community"
"Spiritual Speaking Engagements","Speaking Models","speaking, events, spiritual","Visibility and income","Scaling","Framework","3 months","Advanced","Speaking skills","$2-15k per event","spiritual speaking engagements","Paid spiritual speaking opportunities"
"Sacred Workspace Design","Service Models","workspace, design, energy","Environment optimization","Established","Framework","2 weeks","Intermediate","Design skills","$3-10k per project","workspace design sacred energy","Creating soul-aligned workspaces"
"Spiritual Business Coaching Certification","Certification Models","certification, coaching, business","Teaching others","Established","Framework","12 months","Advanced","Proven results","$15-75k per cohort","coaching certification spiritual business","Certifying spiritual business coaches"
"Goddess Circle Facilitation","Facilitation Models","goddess, feminine, circles","Divine feminine work","Starting out","Framework","1 month","Intermediate","Feminine wisdom","$1-5k per circle","goddess circle feminine facilitation","Women's empowerment circles"
"Sacred Plant Medicine Integration","Integration Models","plant medicine, integration, healing","Post-ceremony support","Advanced","Framework","3 months","Advanced","Plant medicine experience","$5-20k monthly","plant medicine integration healing","Supporting spiritual journeys"
"Spiritual Business Incubator","Incubator Models","incubator, startup, spiritual","Supporting new entrepreneurs","Established","Framework","12 months","Advanced","Business success","$20-100k per cohort","business incubator spiritual","6-month spiritual business launch program"
"Crystal Healing Business","Healing Models","crystals, healing, energy","Crystal work monetization","Starting out","Framework","1 week","Beginner","Crystal knowledge","$1-6k monthly","crystal healing business","Crystal healing sessions and products"
"Spiritual Travel Experiences","Experience Models","travel, spiritual, journeys","Experiential income","Established","Framework","6 months","Advanced","Travel planning","$5-50k per trip","spiritual travel experiences","Sacred site pilgrimages and retreats"
"Akashic Records Reading","Reading Models","akashic records, soul, guidance","Soul-level guidance","Starting out","Framework","2 weeks","Advanced","Akashic training","$2-10k monthly","akashic records reading soul","Deep soul guidance sessions"
"Spiritual Business Mastercourse","Course Models","mastercourse, business, comprehensive","Complete education","Scaling","Framework","6 months","Advanced","Teaching ability","$10-50k monthly","mastercourse spiritual business","Comprehensive spiritual business education"
"Sacred Sexuality Coaching","Coaching Models","sexuality, sacred, healing","Sexual healing work","Advanced","Framework","3 months","Advanced","Sexuality training","$5-25k monthly","sacred sexuality coaching healing","Healing relationship with sexuality"
"Spiritual Emergency Support","Support Models","crisis, emergency, spiritual","Crisis support income","Advanced","Framework","1 month","Advanced","Crisis training","$3-15k monthly","spiritual emergency crisis support","Supporting spiritual emergencies"
"Divine Feminine Business","Feminine Models","divine feminine, business, flow","Feminine approach to business","Starting out","Framework","2 months","Intermediate","Feminine wisdom","Flowing business growth","divine feminine business flow","Business aligned with feminine principles"
"Shamanic Healing Practice","Healing Models","shamanic, healing, soul retrieval","Ancient healing monetization","Advanced","Framework","2 years","Advanced","Shamanic training","$5-30k monthly","shamanic healing practice","Traditional shamanic healing services"
"Spiritual Tech Consulting","Consulting Models","technology, spiritual, integration","Tech-spiritual bridge","Established","Framework","3 months","Advanced","Tech expertise","$10-40k monthly","spiritual tech consulting","Helping spiritual businesses with technology"
"Sacred Sound Healing","Healing Models","sound healing, bowls, vibration","Sound healing income","Starting out","Framework","1 month","Intermediate","Sound training","$2-8k monthly","sound healing bowls sacred","Sound baths and healing sessions"
"Spiritual Business Podcast","Media Models","podcast, business, education","Authority building","Scaling","Framework","6 months","Intermediate","Podcasting skills","$3-15k monthly","podcast spiritual business","Educational spiritual business content"
"Angel Reading Services","Reading Models","angel, guidance, messages","Angelic guidance income","Starting out","Framework","1 week","Intermediate","Angel connection","$2-10k monthly","angel reading guidance messages","Connecting clients with angelic guidance"
"Spiritual Copywriting Agency","Agency Models","copywriting, agency, spiritual","Scaling writing services","Established","Framework","6 months","Advanced","Team building","$10-50k monthly","copywriting agency spiritual","Full-service spiritual marketing copy"
"Sacred Breathwork Facilitation","Facilitation Models","breathwork, healing, transformation","Breath healing income","Starting out","Framework","2 months","Advanced","Breathwork training","$3-12k monthly","breathwork facilitation sacred","Transformational breathing sessions"
"Spiritual Business Software","Software Models","software, tools, spiritual","Software development","Established","Framework","12 months","Advanced","Development team","$20-200k monthly","spiritual business software","Apps and tools for spiritual entrepreneurs"
"Manifestation Coaching Practice","Coaching Models","manifestation, creation, abundance","Teaching manifestation","Starting out","Framework","1 month","Intermediate","Manifestation mastery","$3-15k monthly","manifestation coaching practice","Helping others manifest their dreams"
"Sacred Geometry Design Services","Design Models","sacred geometry, design, art","Spiritual design income","Starting out","Framework","2 weeks","Intermediate","Design skills","$2-8k monthly","sacred geometry design services","Spiritual art and design services"
"Spiritual Business Retreat Center","Physical Models","retreat center, hosting, space","Location-based business","Established","Framework","2 years","Advanced","Significant capital","$25-150k monthly","retreat center spiritual business","Operating a spiritual retreat facility"
"Astrology Business Consulting","Consulting Models","astrology, business, timing","Astrological business guidance","Established","Framework","3 months","Advanced","Astrology expertise","$5-25k monthly","astrology business consulting","Using astrology for business decisions"
"Spiritual Affiliate Network","Network Models","affiliate, network, spiritual","Community monetization","Scaling","Framework","6 months","Advanced","Large network","$5-30k monthly","affiliate network spiritual","Network of spiritual product affiliates"
"Sacred Text Translation Services","Service Models","translation, sacred texts, spiritual","Language services","Starting out","Framework","1 week","Intermediate","Language skills","$2-10k monthly","translation sacred texts spiritual","Translating spiritual content"
"Spiritual Business Legal Services","Legal Models","legal, spiritual business, protection","Legal specialization","Established","Framework","2 years","Advanced","Legal degree","$15-75k monthly","legal spiritual business services","Legal services for spiritual entrepreneurs"
"Sacred Architecture Consulting","Consulting Models","architecture, sacred space, design","Space design income","Established","Framework","6 months","Advanced","Architecture background","$10-50k per project","architecture sacred space consulting","Designing sacred spaces and buildings"
"Spiritual Investment Consulting","Financial Models","investment, spiritual, ethical","Ethical investing","Established","Framework","6 months","Advanced","Financial background","$5-25k monthly","spiritual investment consulting","Helping with ethical investment choices"
"Energy-Based Marketing Agency","Agency Models","marketing, energy, spiritual","Spiritual marketing services","Established","Framework","6 months","Advanced","Marketing expertise","$15-75k monthly","energy marketing agency spiritual","Full-service spiritual marketing"
"Conscious Business Broker","Brokerage Models","business broker, conscious, spiritual","Business transactions","Established","Framework","12 months","Advanced","Business valuation","$10-100k per deal","conscious business broker","Facilitating spiritual business sales"