Title,Category,Tags,Challenge_Addressed,Business_Stage,Resource_Type,Time_Investment,Difficulty_Level,Prerequisites,Expected_Outcome,Keywords,Description
"Sacred Circle Opening Ceremony","Opening Rituals","opening, ceremony, sacred","Professional circle beginnings","Starting out","Guide","15 min","Intermediate","Basic facilitation","Powerful sacred container","sacred circle opening ceremony","Step-by-step circle opening ritual"
"Heart-Centered Check-In Process","Check-In Guides","check-in, heart, emotions","Creating emotional safety","All stages","Process","20 min","Beginner","None","Emotionally connected group","heart check-in process","Facilitating authentic emotional sharing"
"Sacred Listening Circle Format","Listening Guides","listening, sacred, witnessing","Deep listening practice","All stages","Format","45 min","Intermediate","Listening skills","Enhanced group connection","sacred listening circle","Structured deep listening practice"
"Energy Clearing Circle Protocol","Energy Work","energy clearing, group, healing","Group energy management","All stages","Protocol","30 min","Advanced","Energy work training","Clear group energy","energy clearing circle protocol","Group energy clearing procedures"
"Spiritual Business Brainstorming Circle","Business Circles","brainstorming, business, creativity","Creative business solutions","Scaling","Guide","1 hour","Intermediate","Business knowledge","Innovative ideas","spiritual business brainstorming","Sacred approach to business ideation"
"Conflict Resolution Circle Process","Conflict Resolution","conflict, resolution, peace","Handling group conflicts","All stages","Process","90 min","Advanced","Mediation training","Peaceful resolution","conflict resolution circle","Spiritual conflict transformation"
"Manifestation Circle Facilitation","Manifestation Circles","manifestation, creation, abundance","Group manifestation support","All stages","Guide","1 hour","Intermediate","Manifestation knowledge","Collective manifesting power","manifestation circle facilitation","Group manifestation practices"
"Sacred Storytelling Circle","Storytelling Circles","storytelling, sacred, sharing","Meaningful connection through stories","All stages","Format","60 min","Beginner","None","Deep community bonds","storytelling circle sacred","Structured spiritual story sharing"
"Healing Circle Facilitation Guide","Healing Circles","healing, group, transformation","Group healing experiences","Advanced","Guide","90 min","Advanced","Healing training","Community healing","healing circle facilitation","Safe group healing space creation"
"Wisdom Council Circle Format","Council Circles","wisdom, council, decision-making","Collective decision making","Established","Format","2 hours","Advanced","Group dynamics","Wise group decisions","wisdom council circle","Traditional council decision-making"
"Sacred Grief Circle Protocol","Grief Circles","grief, loss, healing","Supporting community loss","All stages","Protocol","90 min","Advanced","Grief counseling","Healing grief support","grief circle sacred protocol","Community grief healing process"
"Celebration Circle Ceremony","Celebration Circles","celebration, joy, achievement","Acknowledging success","All stages","Ceremony","45 min","Beginner","None","Joyful community energy","celebration circle ceremony","Group celebration rituals"
"Shadow Work Circle Guidelines","Shadow Work","shadow work, integration, healing","Personal growth support","Advanced","Guidelines","2 hours","Advanced","Shadow work training","Integrated shadow aspects","shadow work circle guidelines","Safe shadow integration in groups"
"Spiritual Peer Coaching Circle","Peer Coaching","peer coaching, spiritual, support","Mutual coaching support","Scaling","Format","90 min","Advanced","Coaching skills","Enhanced coaching abilities","spiritual peer coaching circle","Peer coaching in spiritual context"
"Sacred Visioning Circle Process","Visioning Circles","visioning, future, creation","Collective future planning","All stages","Process","2 hours","Advanced","Visioning experience","Clear collective vision","visioning circle sacred process","Group future visioning sessions"
"Intuitive Circle Facilitation","Intuitive Circles","intuitive, psychic, development","Developing group intuition","All stages","Guide","1 hour","Advanced","Intuitive development","Stronger group intuition","intuitive circle facilitation","Developing collective intuitive abilities"
"Sacred Fire Circle Ceremony","Fire Circles","fire ceremony, release, transformation","Transformation ritual","All stages","Ceremony","2 hours","Advanced","Fire ceremony training","Deep transformation","fire circle ceremony sacred","Traditional fire ceremony for groups"
"Spiritual Business Success Circle","Success Circles","success, business, celebration","Business achievement support","Scaling","Format","1 hour","Intermediate","Business success","Celebrated achievements","spiritual business success circle","Celebrating spiritual business wins"
"Forgiveness Circle Process","Forgiveness Circles","forgiveness, healing, release","Healing relationships","All stages","Process","90 min","Advanced","Forgiveness work","Released resentments","forgiveness circle process","Group forgiveness healing"
"Sacred Abundance Circle Ritual","Abundance Circles","abundance, prosperity, ritual","Money mindset healing","All stages","Ritual","1 hour","Intermediate","Money mindset work","Healthy money relationship","abundance circle ritual sacred","Group abundance mindset healing"
"Community Boundary Setting Circle","Boundary Circles","boundaries, respect, clarity","Healthy community boundaries","All stages","Guide","45 min","Intermediate","Boundary awareness","Clear group boundaries","boundary setting circle community","Establishing healthy group boundaries"
"Spiritual Emergency Support Circle","Crisis Circles","crisis, emergency, support","Mental health crisis support","All stages","Protocol","Immediate","Advanced","Crisis training","Safe crisis containment","spiritual emergency support circle","Community mental health crisis response"
"Sacred Partnership Circle Format","Partnership Circles","partnership, relationship, sacred","Relationship support","All stages","Format","90 min","Advanced","Relationship work","Stronger partnerships","partnership circle sacred format","Supporting spiritual relationships"
"Moon Circle Ceremony Guide","Moon Circles","moon ceremony, lunar, ritual","Lunar cycle alignment","All stages","Guide","1 hour","Intermediate","Moon cycle knowledge","Lunar alignment","moon circle ceremony guide","Monthly lunar ceremony facilitation"
"Spiritual Business Accountability Circle","Accountability Circles","accountability, business, goals","Goal achievement support","Scaling","Format","1 hour","Intermediate","Goal setting","Achieved business goals","spiritual business accountability","Business accountability in sacred space"
"Sacred Closing Circle Ritual","Closing Rituals","closing, completion, gratitude","Meaningful circle endings","All stages","Ritual","15 min","Beginner","None","Complete circle closure","closing circle ritual sacred","Powerful circle closing ceremony"
"Community Integration Circle","Integration Circles","integration, community, belonging","New member integration","All stages","Process","60 min","Intermediate","Group dynamics","Integrated community members","integration circle community","Helping new members feel included"
"Spiritual Teacher Circle Support","Teacher Circles","teacher, support, development","Teacher development","Established","Format","2 hours","Advanced","Teaching experience","Supported spiritual teachers","teacher circle spiritual support","Peer support for spiritual teachers"
"Sacred Decision Making Circle","Decision Circles","decision making, consensus, sacred","Group decision processes","All stages","Process","90 min","Advanced","Consensus training","Wise group decisions","decision making circle sacred","Spiritual approach to group decisions"
"Energy Protection Circle Ritual","Protection Circles","protection, energy, safety","Group energy protection","All stages","Ritual","30 min","Advanced","Energy protection","Protected group energy","protection circle energy ritual","Creating energetic protection for groups"
"Spiritual Business Launch Circle","Launch Circles","launch, business, support","New business launch support","Starting out","Support","2 hours","Intermediate","Business launch","Successful business launch","business launch circle spiritual","Community support for business launches"
"Sacred Healing Request Circle","Request Circles","healing request, prayer, support","Organizing healing support","All stages","Format","30 min","Intermediate","Healing coordination","Coordinated healing prayers","healing request circle sacred","Community healing request process"
"Community Appreciation Circle","Appreciation Circles","appreciation, gratitude, recognition","Member recognition","All stages","Format","45 min","Beginner","None","Appreciated community","appreciation circle community","Regular member appreciation practice"
"Spiritual Challenge Support Circle","Challenge Circles","challenge, support, resilience","Crisis resilience","All stages","Support","60 min","Advanced","Crisis support training","Resilient community","challenge support circle spiritual","Supporting members through difficulties"
"Sacred Business Mastercass Circle","Masterclass Circles","masterclass, business, learning","Advanced business education","Established","Format","3 hours","Advanced","Business expertise","Advanced business skills","business masterclass circle sacred","Advanced spiritual business education"
"Community Healing Prayer Circle","Prayer Circles","prayer, healing, collective","Group prayer coordination","All stages","Format","30 min","Intermediate","Prayer experience","Powerful collective prayers","healing prayer circle community","Coordinated community healing prayers"
"Spiritual Leadership Development Circle","Leadership Circles","leadership, development, spiritual","Leadership skill building","Established","Format","2 hours","Advanced","Leadership potential","Strong spiritual leaders","leadership development circle","Developing spiritual community leaders"
"Sacred Money Healing Circle","Money Circles","money, healing, abundance","Money trauma healing","All stages","Healing","90 min","Advanced","Money healing training","Healed money relationship","money healing circle sacred","Group money trauma healing"
"Community Vision Quest Support","Quest Support","vision quest, journey, support","Solo journey support","Advanced","Support","Varies","Advanced","Vision quest training","Successful spiritual quests","vision quest support community","Supporting individual spiritual journeys"
"Sacred Business Partnership Circle","Partnership Circles","partnership, business, collaboration","Partnership creation","Established","Format","90 min","Advanced","Partnership experience","Strong business partnerships","business partnership circle sacred","Creating spiritual business partnerships"
"Spiritual Breakthrough Circle","Breakthrough Circles","breakthrough, transformation, growth","Personal breakthrough support","All stages","Support","2 hours","Advanced","Transformation work","Significant personal growth","breakthrough circle spiritual","Supporting major life transformations"
"Community Wisdom Keeper Circle","Wisdom Circles","wisdom, keeper, elder","Elder wisdom sharing","All stages","Format","90 min","Advanced","Life experience","Preserved community wisdom","wisdom keeper circle community","Honoring and preserving elder wisdom"
"Sacred Business Mastermind Circle","Mastermind Circles","mastermind, business, high-level","Elite business development","Established","Format","3 hours","Advanced","Significant business success","Exponential business growth","business mastermind circle sacred","High-level spiritual business mastermind"
"Energy Healing Training Circle","Training Circles","training, healing, energy","Skill development","Starting out","Training","2 hours","Advanced","Healing aptitude","Developed healing abilities","healing training circle energy","Group energy healing skill development"
"Community Blessing Circle Ritual","Blessing Circles","blessing, ritual, community","Community blessing","All stages","Ritual","45 min","Intermediate","Ritual knowledge","Blessed community","blessing circle ritual community","Community blessing ceremony"
"Spiritual Business Exit Strategy Circle","Exit Circles","exit strategy, transition, business","Business transition support","Established","Support","2 hours","Advanced","Business transition","Graceful business transition","business exit strategy spiritual","Supporting spiritual business transitions"
"Sacred Inner Child Healing Circle","Inner Child Circles","inner child, healing, playfulness","Inner child integration","All stages","Healing","2 hours","Advanced","Inner child work","Integrated inner child","inner child healing circle","Group inner child healing work"
"Community Sacred Activism Circle","Activism Circles","activism, sacred, service","Purpose-driven action","All stages","Format","90 min","Advanced","Social justice awareness","Aligned community action","sacred activism circle community","Spiritual approach to social change"
"Spiritual Business Mentorship Circle","Mentorship Circles","mentorship, business, guidance","Business mentoring","Established","Format","2 hours","Advanced","Business success","Mentored spiritual entrepreneurs","business mentorship circle spiritual","Mentoring new spiritual entrepreneurs"
"Sacred Death and Rebirth Circle","Transformation Circles","death, rebirth, transformation","Major life transitions","Advanced","Ceremony","3 hours","Advanced","Death/rebirth work","Successful life transitions","death rebirth circle sacred","Supporting major life transformations"
"Community Sacred Plant Integration","Integration Circles","plant medicine, integration, healing","Post-ceremony integration","Advanced","Integration","2 hours","Advanced","Plant medicine experience","Integrated spiritual experiences","plant integration community sacred","Supporting plant medicine integration"