Title,Category,Tags,Challenge_Addressed,Business_Stage,Resource_Type,Time_Investment,Difficulty_Level,Prerequisites,Expected_Outcome,Keywords,Description
"I align my business with my highest spiritual purpose","Daily Affirmations","purpose, alignment, spiritual","Lack of clarity","Starting out","Affirmation","2 min","Beginner","None","Clear direction","purpose alignment spiritual","Morning affirmation for business clarity"
"My spiritual gifts are valuable and worthy of compensation","Daily Affirmations","self-worth, monetization, gifts","Money blocks","Starting out","Affirmation","2 min","Beginner","None","Confidence in pricing","self-worth money spiritual gifts","Affirmation for overcoming money blocks"
"I attract soul-aligned clients who appreciate my authentic work","Daily Affirmations","clients, attraction, authenticity","Finding right clients","Scaling","Affirmation","2 min","Beginner","None","Better client attraction","soul clients authentic attraction","Client magnetism affirmation"
"My business grows in divine timing and perfect order","Daily Affirmations","patience, timing, growth","Impatience with results","All stages","Affirmation","2 min","Beginner","None","Inner peace with growth","divine timing patience growth","Patience and trust affirmation"
"I trust my intuition to guide my business decisions","Daily Affirmations","intuition, decisions, trust","Overthinking","All stages","Affirmation","2 min","Beginner","None","Better decision making","intuition trust decisions","Decision-making confidence"
"My authentic message resonates with those meant to hear it","Daily Affirmations","authenticity, message, resonance","Fear of judgment","Starting out","Affirmation","2 min","Beginner","None","Confidence in sharing","authentic message resonance","Message clarity affirmation"
"I am a vessel for transformation and healing in the world","Daily Affirmations","service, transformation, healing","Doubt about impact","All stages","Affirmation","2 min","Beginner","None","Sense of purpose","service transformation healing","Purpose and impact affirmation"
"My business flows with ease and grace","Daily Affirmations","ease, flow, grace","Struggle and force","Scaling","Affirmation","2 min","Beginner","None","Effortless growth","ease flow grace business","Flow state affirmation"
"I charge what I'm worth with confidence and love","Daily Affirmations","pricing, worth, confidence","Undercharging","Starting out","Affirmation","2 min","Beginner","None","Better pricing confidence","pricing worth confidence","Pricing confidence affirmation"
"My spiritual practice enhances my business success","Daily Affirmations","practice, integration, success","Separation of spiritual/business","All stages","Affirmation","2 min","Beginner","None","Integrated approach","spiritual practice business success","Integration affirmation"
"I am supported by the universe in my business journey","Daily Affirmations","support, universe, journey","Feeling alone","All stages","Affirmation","2 min","Beginner","None","Sense of support","universe support journey","Universal support affirmation"
"My vulnerability is a superpower in business","Daily Affirmations","vulnerability, strength, power","Fear of being vulnerable","Starting out","Affirmation","2 min","Beginner","None","Authentic connection","vulnerability superpower strength","Vulnerability as strength"
"I create sacred space in everything I do","Daily Affirmations","sacred space, intention, presence","Lack of intentionality","All stages","Affirmation","2 min","Beginner","None","Intentional business","sacred space intention presence","Sacred business practice"
"My business is a form of prayer in action","Daily Affirmations","prayer, service, devotion","Seeing business as unspiritual","All stages","Affirmation","2 min","Beginner","None","Sacred view of business","prayer service devotion business","Business as spiritual practice"
"I trust the process even when I can't see the outcome","Daily Affirmations","trust, process, faith","Need for control","All stages","Affirmation","2 min","Beginner","None","Surrender and trust","trust process faith outcome","Trust in the journey"
"My heart-centered approach attracts abundance","Daily Affirmations","heart-centered, abundance, attraction","Scarcity mindset","Starting out","Affirmation","2 min","Beginner","None","Abundance mindset","heart-centered abundance attraction","Heart-centered abundance"
"I speak my truth with love and compassion","Daily Affirmations","truth, love, compassion","Fear of speaking up","Starting out","Affirmation","2 min","Beginner","None","Authentic communication","truth love compassion speak","Authentic expression"
"My business serves the highest good of all","Daily Affirmations","service, highest good, purpose","Selfish motivations","All stages","Affirmation","2 min","Beginner","None","Service orientation","service highest good purpose","Service-centered business"
"I release the need to be perfect and embrace my humanity","Daily Affirmations","perfectionism, humanity, acceptance","Perfectionism","All stages","Affirmation","2 min","Beginner","None","Self-acceptance","perfectionism humanity acceptance","Embracing imperfection"
"My business grows in alignment with my values","Daily Affirmations","alignment, values, growth","Compromising values","Scaling","Affirmation","2 min","Beginner","None","Value-aligned growth","alignment values growth","Values-based business"
"I am worthy of success and abundance","Daily Affirmations","worthiness, success, abundance","Unworthiness","All stages","Affirmation","2 min","Beginner","None","Self-worth","worthiness success abundance","Core worthiness affirmation"
"My sensitivity is a gift that serves my clients","Daily Affirmations","sensitivity, gift, service","Seeing sensitivity as weakness","Starting out","Affirmation","2 min","Beginner","None","Strength in sensitivity","sensitivity gift service","Sensitivity as strength"
"I create boundaries that honor my energy","Daily Affirmations","boundaries, energy, honor","Poor boundaries","All stages","Affirmation","2 min","Beginner","None","Healthy boundaries","boundaries energy honor","Energy management"
"My business reflects my soul's deepest calling","Daily Affirmations","soul calling, reflection, purpose","Misalignment","Starting out","Affirmation","2 min","Beginner","None","Soul alignment","soul calling reflection purpose","Soul purpose in business"
"I trust divine timing in my business expansion","Daily Affirmations","divine timing, expansion, trust","Impatience with growth","Scaling","Affirmation","2 min","Beginner","None","Patient expansion","divine timing expansion trust","Trusting growth timing"