Title,Category,Tags,Challenge_Addressed,Business_Stage,Resource_Type,Time_Investment,Difficulty_Level,Prerequisites,Expected_Outcome,Keywords,Description
"Sacred 1:1 Coaching Package Structure","Coaching Packages","coaching, 1:1, sacred","Coaching service packaging","Starting out","Template","1 hour","Intermediate","Coaching skills","Professional coaching package","coaching 1on1 sacred package","Complete 1:1 spiritual coaching package"
"Energy Healing Session Pricing Tiers","Healing Pricing","energy healing, pricing, tiers","Healing service pricing","Starting out","Pricing","30 min","Intermediate","Healing certification","Confident healing pricing","energy healing pricing tiers","Tiered pricing for energy healing sessions"
"Spiritual Group Program Package Design","Group Packages","group program, spiritual, design","Group offering structure","Scaling","Template","2 hours","Advanced","Group facilitation","Professional group packages","group program spiritual package","Complete spiritual group program design"
"Sacred Retreat Pricing Framework","Retreat Pricing","retreat, pricing, sacred","Retreat pricing strategy","Established","Framework","1 hour","Advanced","Event planning","Profitable retreat pricing","retreat pricing sacred framework","Comprehensive retreat pricing strategy"
"Intuitive Reading Service Packages","Reading Packages","intuitive readings, packages, psychic","Reading service structure","Starting out","Template","45 min","Intermediate","Psychic abilities","Professional reading packages","intuitive reading packages","Structured psychic reading offerings"
"Spiritual Mentorship Program Pricing","Mentorship Pricing","mentorship, pricing, spiritual","Mentorship monetization","Established","Pricing","1 hour","Advanced","Mentorship experience","Valuable mentorship pricing","mentorship pricing spiritual","Professional spiritual mentorship pricing"
"Conscious Business Consulting Rates","Consulting Rates","consulting, rates, conscious","Consulting pricing","Established","Rates","30 min","Advanced","Business expertise","Professional consulting rates","consulting rates conscious","Spiritual business consulting pricing"
"Sacred Ceremony Pricing Guide","Ceremony Pricing","ceremony, pricing, sacred","Ceremony monetization","Starting out","Guide","45 min","Intermediate","Ceremony training","Professional ceremony pricing","ceremony pricing sacred","Pricing guide for spiritual ceremonies"
"Spiritual Course Creation Package","Course Packages","course, creation, spiritual","Course offering design","Scaling","Template","3 hours","Advanced","Teaching ability","Professional spiritual course","course creation spiritual package","Complete spiritual course package design"
"Energy Clearing Service Pricing","Energy Pricing","energy clearing, service, pricing","Energy work monetization","Starting out","Pricing","30 min","Advanced","Energy work training","Confident energy pricing","energy clearing service pricing","Professional energy clearing pricing"
"Spiritual Workshop Package Templates","Workshop Packages","workshop, packages, spiritual","Workshop monetization","Starting out","Template","1 hour","Intermediate","Workshop creation","Professional workshop packages","workshop packages spiritual","Complete spiritual workshop offerings"
"Sacred Mastermind Pricing Structure","Mastermind Pricing","mastermind, pricing, sacred","Mastermind monetization","Established","Structure","90 min","Advanced","Group leadership","Profitable mastermind pricing","mastermind pricing sacred","High-value mastermind pricing strategy"
"Spiritual Business VIP Day Packages","VIP Packages","VIP day, intensive, spiritual","Intensive service packaging","Scaling","Template","2 hours","Advanced","Intensive delivery","High-value VIP offerings","VIP day spiritual packages","Intensive spiritual business VIP day design"
"Conscious Subscription Pricing Model","Subscription Pricing","subscription, conscious, recurring","Recurring revenue strategy","Scaling","Model","1 hour","Advanced","Subscription service","Predictable recurring income","subscription conscious pricing","Spiritual subscription service pricing"
"Sacred Product Bundle Pricing","Bundle Pricing","product, bundle, sacred","Product monetization","Scaling","Pricing","45 min","Intermediate","Digital products","Attractive product bundles","product bundle sacred pricing","Spiritual product bundle pricing strategy"
"Spiritual Affiliate Program Commission Structure","Affiliate Pricing","affiliate, commission, spiritual","Affiliate program design","Scaling","Structure","30 min","Advanced","Affiliate experience","Profitable affiliate program","affiliate commission spiritual","Spiritual business affiliate commission rates"
"Energy-Based Service Pricing Calculator","Pricing Calculators","calculator, energy-based, service","Pricing calculation","Starting out","Calculator","1 hour","Advanced","Service experience","Accurate service pricing","energy service pricing calculator","Calculator for energy-based service pricing"
"Sacred Speaking Engagement Fees","Speaking Fees","speaking, fees, sacred","Speaking monetization","Established","Fees","30 min","Advanced","Speaking experience","Professional speaking fees","speaking fees sacred","Spiritual speaking engagement pricing"
"Spiritual Business Retainer Packages","Retainer Packages","retainer, packages, ongoing","Ongoing service structure","Scaling","Template","90 min","Advanced","Service delivery","Stable retainer income","retainer packages spiritual","Ongoing spiritual business retainer design"
"Conscious Licensing Fee Structure","Licensing Fees","licensing, fees, conscious","IP monetization","Established","Structure","1 hour","Advanced","Proven methodology","Licensing income","licensing fees conscious","Spiritual methodology licensing fees"
"Sacred Therapy Session Pricing","Therapy Pricing","therapy, pricing, sacred","Therapy monetization","Advanced","Pricing","30 min","Advanced","Therapy training","Professional therapy pricing","therapy pricing sacred","Spiritual therapy session pricing"
"Spiritual Business Audit Packages","Audit Packages","audit, packages, business","Business assessment monetization","Established","Template","1 hour","Advanced","Business expertise","Professional audit packages","audit packages business","Spiritual business audit service packages"
"Energy Protection Service Pricing","Protection Pricing","protection, service, energy","Protection work monetization","Advanced","Pricing","30 min","Advanced","Protection training","Professional protection pricing","protection service energy pricing","Energy protection service pricing"
"Sacred Brand Design Package Pricing","Brand Pricing","brand, design, sacred","Brand design monetization","Starting out","Pricing","45 min","Advanced","Design skills","Professional brand pricing","brand design sacred pricing","Spiritual brand design service pricing"
"Spiritual Copywriting Service Rates","Copywriting Rates","copywriting, rates, spiritual","Copy service pricing","Scaling","Rates","30 min","Advanced","Copywriting skills","Professional copy rates","copywriting rates spiritual","Spiritual copywriting service pricing"
"Conscious Investment Consulting Fees","Investment Fees","investment, consulting, conscious","Investment advice pricing","Established","Fees","45 min","Advanced","Investment expertise","Professional investment fees","investment consulting conscious","Spiritual investment consulting pricing"
"Sacred Space Design Package Pricing","Space Design Pricing","space design, sacred, pricing","Space design monetization","Starting out","Pricing","1 hour","Intermediate","Design skills","Professional space design pricing","space design sacred pricing","Sacred space design service pricing"
"Spiritual Business Photography Packages","Photography Packages","photography, packages, spiritual","Photography service design","Starting out","Template","1 hour","Intermediate","Photography skills","Professional photo packages","photography packages spiritual","Spiritual business photography packages"
"Energy Reading Premium Service Tiers","Reading Tiers","energy reading, tiers, premium","Reading service levels","Starting out","Tiers","45 min","Advanced","Reading abilities","Multi-level reading services","energy reading tiers premium","Tiered energy reading service offerings"
"Sacred Ritual Facilitation Pricing","Ritual Pricing","ritual, facilitation, sacred","Ritual monetization","Starting out","Pricing","30 min","Advanced","Ritual training","Professional ritual pricing","ritual facilitation sacred pricing","Spiritual ritual facilitation pricing"
"Spiritual Business Legal Service Rates","Legal Rates","legal, rates, spiritual","Legal service pricing","Established","Rates","30 min","Advanced","Legal training","Professional legal rates","legal rates spiritual","Spiritual business legal service pricing"
"Conscious Technology Consulting Packages","Tech Packages","technology, consulting, conscious","Tech consulting structure","Established","Template","90 min","Advanced","Tech expertise","Professional tech packages","technology consulting conscious","Spiritual-tech consulting packages"
"Sacred Healing Retreat Pricing Model","Retreat Pricing","healing retreat, pricing, model","Retreat monetization","Established","Model","2 hours","Advanced","Retreat hosting","Profitable healing retreat","healing retreat pricing model","Complete healing retreat pricing strategy"
"Spiritual Business Course Platform Pricing","Course Pricing","course, platform, spiritual","Online course pricing","Scaling","Pricing","1 hour","Advanced","Course creation","Profitable spiritual courses","course platform spiritual pricing","Online spiritual course pricing strategy"
"Energy Alignment Intensive Packages","Intensive Packages","alignment, intensive, energy","Intensive service design","Scaling","Template","90 min","Advanced","Energy work","High-value intensive packages","alignment intensive energy","Energy alignment intensive service design"
"Sacred Business Coaching Certification Pricing","Certification Pricing","certification, coaching, sacred","Certification program pricing","Established","Pricing","1 hour","Advanced","Certification creation","Profitable certification program","certification coaching sacred","Spiritual coaching certification pricing"
"Spiritual Podcast Sponsorship Rates","Sponsorship Rates","podcast, sponsorship, rates","Podcast monetization","Scaling","Rates","30 min","Intermediate","Podcast audience","Podcast sponsorship income","podcast sponsorship rates","Spiritual podcast advertising rates"
"Conscious Business Mastermind Pricing","Mastermind Pricing","mastermind, pricing, conscious","Mastermind monetization","Established","Pricing","90 min","Advanced","Mastermind leadership","Profitable mastermind pricing","mastermind pricing conscious","High-level spiritual mastermind pricing"
"Sacred Art Therapy Session Packages","Art Therapy Packages","art therapy, packages, sacred","Art therapy service design","Starting out","Template","1 hour","Advanced","Art therapy training","Professional art therapy packages","art therapy packages sacred","Sacred art therapy service packages"
"Spiritual Business Book Publishing Packages","Publishing Packages","book, publishing, spiritual","Book project pricing","Established","Template","2 hours","Advanced","Publishing knowledge","Professional book packages","book publishing spiritual","Spiritual book publishing service packages"
"Energy Medicine Practitioner Rates","Medicine Rates","energy medicine, rates, practitioner","Energy medicine pricing","Advanced","Rates","30 min","Advanced","Medical training","Professional medicine rates","energy medicine rates","Energy medicine practitioner pricing"
"Sacred Plant Medicine Integration Pricing","Plant Medicine Pricing","plant medicine, integration, pricing","Integration service pricing","Advanced","Pricing","45 min","Advanced","Plant medicine training","Professional integration pricing","plant medicine integration pricing","Plant medicine integration service pricing"
"Spiritual Business Software Development Rates","Software Rates","software, development, spiritual","Software service pricing","Advanced","Rates","45 min","Advanced","Software development","Professional software rates","software development spiritual","Spiritual business software development pricing"
"Conscious Web Design Package Pricing","Web Design Pricing","web design, conscious, packages","Web design monetization","Starting out","Pricing","1 hour","Intermediate","Web design skills","Professional web design pricing","web design conscious pricing","Spiritual web design service packages"
"Sacred Business Writing Service Rates","Writing Rates","writing, service, sacred","Writing service pricing","Starting out","Rates","30 min","Intermediate","Writing skills","Professional writing rates","writing service sacred rates","Spiritual business writing service pricing"
"Spiritual Event Planning Package Pricing","Event Pricing","event planning, spiritual, packages","Event service monetization","Scaling","Pricing","90 min","Advanced","Event planning","Professional event packages","event planning spiritual pricing","Spiritual event planning service packages"
"Energy Healing Practitioner Insurance Rates","Insurance Rates","insurance, healing, practitioner","Professional insurance","All stages","Rates","15 min","Beginner","Practice establishment","Protected healing practice","insurance healing practitioner","Professional liability insurance for healers"
"Sacred Business Coaching Hourly Rates","Hourly Rates","coaching, hourly, sacred","Hour-based coaching pricing","Starting out","Rates","20 min","Intermediate","Coaching certification","Professional hourly coaching rates","coaching hourly sacred rates","Hourly spiritual business coaching rates"
"Spiritual Business Membership Site Pricing","Membership Pricing","membership, site, spiritual","Membership monetization","Scaling","Pricing","1 hour","Advanced","Membership platform","Sustainable membership income","membership site spiritual pricing","Spiritual business membership pricing strategy"
"Conscious Business Accelerator Package Pricing","Accelerator Pricing","accelerator, package, conscious","Accelerator program pricing","Established","Pricing","2 hours","Advanced","Proven results","High-value accelerator pricing","accelerator package conscious","Spiritual business accelerator pricing"
"Sacred Healing Arts Certification Pricing","Certification Pricing","certification, healing arts, sacred","Healing certification monetization","Established","Pricing","90 min","Advanced","Healing mastery","Profitable healing certification","certification healing arts sacred","Healing arts certification program pricing"
"Spiritual Business Legal Consultation Rates","Legal Consultation","legal, consultation, spiritual","Legal service pricing","Established","Rates","30 min","Advanced","Legal expertise","Professional legal consultation rates","legal consultation spiritual","Spiritual business legal consultation pricing"